{
  "schema_version": "2",
  "kind": "decision",
  "decision_id": "safe-release-example",
  "context": { "objective": "test release" },
  "candidates": [
    { "id": "deploy_now", "payload": { "operation": "full_deploy" } },
    { "id": "deploy_canary", "payload": { "operation": "canary_deploy" } }
  ]
}
