{
  "schema_version": "2",
  "kind": "decision",
  "decision_id": "agent-report-step-1",
  "context": { "objective": "prepare report for review" },
  "candidates": [
    { "id": "read_report", "payload": { "tool": "read_report" } },
    { "id": "edit_report", "payload": { "tool": "edit_report" } },
    { "id": "send_report", "payload": { "tool": "send_report" } }
  ]
}
